{
  "schema": "occ.repo-scan-run.v1",
  "run_id": "aaaaaaaaaaaaaaaaaaaaaaaaaaaaaaaaaaaaaaaaaaaaaaaaaaaaaaaaaaaaaaaa",
  "intent_key": "bbbbbbbbbbbbbbbbbbbbbbbbbbbbbbbb",
  "snapshot_id": "cccccccccccccccccccccccccccccccccccccccccccccccccccccccccccccccc",
  "repository": "sce",
  "namespace": "code",
  "profile_revision": "dddddddddddddddddddddddddddddddddddddddddddddddddddddddddddddddd",
  "repo_sha": "eeeeeeeeeeeeeeeeeeeeeeeeeeeeeeeeeeeeeeee",
  "tree_sha": "ffffffffffffffffffffffffffffffffffffffff",
  "control_state": "PAUSED",
  "reason": null,
  "counts": {
    "PENDING": 25,
    "INDEXED": 20,
    "EXCLUDED": 0,
    "ERROR": 0
  },
  "run_revision": 1,
  "cursor": 20,
  "total": 45,
  "ledger_entries": 45,
  "processed": 20,
  "pending": 25,
  "indexed": 20,
  "excluded": 0,
  "errors": 0,
  "inventory_complete": false,
  "exact_for_indexed": null,
  "all_tracked_bytes_exportable": null,
  "ai_delivery": "NOT_PERFORMED"
}
